Doc Title,content,guidance_1,guidance_2,guidance_3,output
The Benefits of Regular Exercise,"Regular physical activity has numerous advantages for both physical and mental well-being. It enhances cardiovascular health, strengthens muscles, and boosts energy levels. Furthermore, exercise is known to improve mood and reduce symptoms of anxiety and depression. Consistency is key to reaping the benefits, with even moderate activity providing significant rewards.",Add examples of specific exercises that enhance cardiovascular health.,Replace 'boosts energy levels' with a more detailed explanation of how exercise impacts energy.,Add a concluding sentence encouraging readers to start small if they’re new to exercise.,"Regular physical activity has numerous advantages for both physical and mental well-being. It enhances cardiovascular health, strengthens muscles, and boosts energy levels. <insert 1>For example, activities such as running, swimming, and cycling are particularly effective for improving cardiovascular health.</insert 1> Furthermore, exercise is known to improve mood and reduce symptoms of anxiety and depression. <delete 2>boosts energy levels</delete 2><insert 2>increases mitochondrial function in cells, leading to greater energy production and improved stamina.</insert 2> Consistency is key to reaping the benefits, with even moderate activity providing significant rewards. <insert 3>If you're new to exercise, start with small, manageable steps, such as a 10-minute daily walk, to build a sustainable habit.</insert 3>"
Importance of Time Management,"Effective time management allows individuals to prioritize tasks and achieve goals efficiently. It minimizes stress and ensures deadlines are met. Poor time management, on the other hand, can lead to procrastination and missed opportunities. Developing a daily schedule and setting clear objectives are key strategies for better time management.",Include an example of a digital tool or app that helps with time management.,Change 'Developing a daily schedule' to a more detailed description of how to plan a daily schedule.,Add a brief paragraph about how time management impacts work-life balance.,"Effective time management allows individuals to prioritize tasks and achieve goals efficiently. <insert 1>Popular tools like Trello, Notion, and Google Calendar can help individuals organize and track their schedules effectively.</insert 1> It minimizes stress and ensures deadlines are met. Poor time management, on the other hand, can lead to procrastination and missed opportunities. <delete 2>Developing a daily schedule</delete 2><insert 2>Creating a daily schedule involves listing tasks in order of priority, allocating specific time slots for each, and ensuring time for breaks to maintain productivity.</insert 2> Developing a daily schedule and setting clear objectives are key strategies for better time management. <insert 3>By managing time effectively, individuals can maintain a better balance between work responsibilities and personal life, reducing burnout.</insert 3>"
The Evolution of Artificial Intelligence,"Artificial intelligence has undergone significant advancements over the past few decades. From rule-based systems to machine learning algorithms, AI has transformed numerous industries, including healthcare, finance, and transportation. As technology progresses, ethical considerations and responsible development are becoming increasingly important.",Add a specific example of how AI has transformed healthcare.,Include a brief section discussing challenges in ethical AI development.,Replace 'numerous industries' with a list of 4 industries and describe how AI impacts each.,"Artificial intelligence has undergone significant advancements over the past few decades. From rule-based systems to machine learning algorithms, AI has transformed numerous industries, including healthcare, finance, and transportation. <insert 1>In healthcare, AI-powered tools like diagnostic imaging and predictive analytics improve accuracy and speed in disease detection.</insert 1> As technology progresses, ethical considerations and responsible development are becoming increasingly important. <insert 2>However, challenges like algorithmic bias, lack of transparency, and misuse of AI remain key ethical concerns requiring proactive regulation.</insert 2> <delete 3>numerous industries</delete 3><insert 3>industries such as retail (personalized recommendations), manufacturing (predictive maintenance), education (adaptive learning systems), and transportation (autonomous vehicles).</insert 3>"
The Wonders of the Solar System,"The solar system consists of the Sun, eight planets, and various other celestial objects, such as moons, asteroids, and comets. Each planet has unique features, from the rings of Saturn to the extreme heat of Venus. Exploring these celestial bodies helps us understand more about the origins of our universe.",Add a fact about the asteroid belt's role in the solar system.,Replace 'unique features' with a detailed description of one planet’s specific feature.,Conclude with a sentence explaining how space exploration inspires scientific innovation.,"The solar system consists of the Sun, eight planets, and various other celestial objects, such as moons, asteroids, and comets. Each planet has unique features, from the rings of Saturn to the extreme heat of Venus. <insert 1>The asteroid belt, located between Mars and Jupiter, acts as a natural divider between the inner rocky planets and outer gas giants.</insert 1> Exploring these celestial bodies helps us understand more about the origins of our universe. <delete 2>unique features</delete 2><insert 2>Saturn’s rings, made up of ice and rock particles, are one of the most visually striking features in the solar system.</insert 2> <insert 3>Space exploration also inspires advancements in technology, such as satellite systems and renewable energy solutions.</insert 3>"
The Impact of Social Media on Communication,"Social media platforms have revolutionized the way people communicate. They enable instant sharing of information, foster global connections, and provide a platform for self-expression. However, they also raise concerns about privacy and misinformation. Balancing the benefits and challenges is essential for responsible use.",Add a specific example of how social media fosters global connections.,Replace 'raise concerns about privacy' with a more detailed explanation of privacy risks.,Add a suggestion for promoting responsible social media use among teenagers.,"Social media platforms have revolutionized the way people communicate. They enable instant sharing of information, foster global connections, and provide a platform for self-expression. <insert 1>For instance, platforms like LinkedIn and Twitter allow professionals worldwide to collaborate and exchange ideas in real time.</insert 1> However, they also raise concerns about privacy and misinformation. <delete 2>raise concerns about privacy</delete 2><insert 2>pose risks such as unauthorized data collection, tracking of online activity, and misuse of personal information.</insert 2> Balancing the benefits and challenges is essential for responsible use. <insert 3>To encourage responsible social media use among teenagers, schools and parents can promote digital literacy programs and establish boundaries for screen time.</insert 3>"
